{
  "contractVersion": "v1",
  "fixtureId": "deterministic-race",
  "trackId": "deterministic-short-loop",
  "trackName": "Deterministic Short Loop",
  "coordinateSpace": {
    "units": "meters",
    "origin": "centerline start/finish midpoint"
  },
  "circuitLengthMeters": 3200,
  "rotationDegrees": 0,
  "startFinish": {
    "center": {
      "x": 0,
      "y": 250
    },
    "inner": {
      "x": -40,
      "y": 250
    },
    "outer": {
      "x": 40,
      "y": 250
    }
  },
  "centerLine": [
    {
      "x": 0,
      "y": 250
    },
    {
      "x": 420,
      "y": 20
    },
    {
      "x": 900,
      "y": 250
    },
    {
      "x": 620,
      "y": 560
    },
    {
      "x": 40,
      "y": 540
    },
    {
      "x": -220,
      "y": 300
    }
  ],
  "innerBoundary": [
    {
      "x": -40,
      "y": 220
    },
    {
      "x": 400,
      "y": -30
    },
    {
      "x": 850,
      "y": 220
    },
    {
      "x": 590,
      "y": 510
    },
    {
      "x": 60,
      "y": 500
    },
    {
      "x": -180,
      "y": 280
    }
  ],
  "outerBoundary": [
    {
      "x": 40,
      "y": 280
    },
    {
      "x": 440,
      "y": 70
    },
    {
      "x": 950,
      "y": 280
    },
    {
      "x": 650,
      "y": 610
    },
    {
      "x": 20,
      "y": 580
    },
    {
      "x": -260,
      "y": 320
    }
  ],
  "distanceMarkersMeters": [
    0,
    500,
    1000,
    1500,
    2000,
    2500,
    3000
  ],
  "drsZones": [
    {
      "startMeters": 450,
      "endMeters": 980
    }
  ]
}
